{
  "$schema": "https://json-schema.org/draft/2020-12/schema",
  "$id": "https://chartmann1590.github.io/porchlight-press/schemas/story.schema.json",
  "title": "Porchlight Press story (article)",
  "description": "One news story: either an AI brief or a deterministic source card. confidenceTier is internal and never shown to users.",
  "type": "object",
  "additionalProperties": false,
  "required": ["apiVersion", "id", "headline", "category", "publishedAt", "generatedAt", "aiGenerated", "locations", "sources"],
  "properties": {
    "apiVersion": {"const": 1},
    "id": {"type": "string", "minLength": 8, "maxLength": 128},
    "headline": {"type": "string", "minLength": 8, "maxLength": 200},
    "dek": {"type": "string", "maxLength": 300},
    "body": {"type": "string", "maxLength": 6000},
    "excerpt": {"type": "string", "maxLength": 300, "description": "Only present when the source rights mode allows excerpts"},
    "category": {"enum": ["local", "public-safety", "business", "technology", "science", "sports", "entertainment", "politics", "health", "environment", "travel", "weather"]},
    "publishedAt": {"type": "string", "format": "date-time"},
    "updatedAt": {"type": "string", "format": "date-time"},
    "generatedAt": {"type": "string", "format": "date-time"},
    "aiGenerated": {"type": "boolean"},
    "aiModel": {"type": "string"},
    "version": {"type": "integer", "minimum": 1},
    "revisions": {
      "type": "array",
      "items": {
        "type": "object",
        "additionalProperties": false,
        "required": ["version", "updatedAt"],
        "properties": {
          "version": {"type": "integer", "minimum": 1},
          "updatedAt": {"type": "string", "format": "date-time"},
          "note": {"type": "string"}
        }
      }
    },
    "confidenceTier": {"enum": ["high", "medium", "low"], "description": "Internal publishing confidence; never displayed"},
    "breaking": {"type": "boolean"},
    "tags": {"type": "array", "items": {"type": "string"}},
    "locations": {
      "type": "array",
      "minItems": 1,
      "items": {
        "type": "object",
        "additionalProperties": false,
        "required": ["country"],
        "properties": {
          "country": {"type": "string", "pattern": "^[A-Z]{2}$"},
          "admin1": {"type": "string", "pattern": "^[A-Z]{2}-[A-Z0-9]{1,3}$"},
          "admin2": {"type": "string"},
          "city": {"type": "string"},
          "metro": {"type": "string"},
          "lat": {"type": "number", "minimum": -90, "maximum": 90},
          "lon": {"type": "number", "minimum": -180, "maximum": 180}
        }
      }
    },
    "image": {
      "type": "object",
      "additionalProperties": false,
      "required": ["url", "attribution"],
      "properties": {
        "url": {"type": "string", "format": "uri"},
        "creator": {"type": "string"},
        "license": {"type": "string"},
        "licenseUrl": {"type": "string", "format": "uri"},
        "sourceUrl": {"type": "string", "format": "uri"},
        "attribution": {"type": "string"}
      }
    },
    "sources": {
      "type": "array",
      "minItems": 1,
      "items": {
        "type": "object",
        "additionalProperties": false,
        "required": ["publisher", "headline", "url"],
        "properties": {
          "publisher": {"type": "string"},
          "headline": {"type": "string"},
          "url": {"type": "string", "format": "uri"},
          "publishedAt": {"type": "string", "format": "date-time"},
          "rightsMode": {"enum": ["PUBLIC_DOMAIN", "OPEN_LICENSE", "RSS_EXCERPT_ALLOWED", "METADATA_ONLY", "LINK_ONLY", "BLOCKED"]},
          "excerpt": {"type": "string", "maxLength": 300}
        }
      }
    }
  },
  "allOf": [
    {
      "if": {"properties": {"aiGenerated": {"const": true}}},
      "then": {"required": ["aiModel", "body"]}
    }
  ]
}
